ID,text,labels,counter_argument
1350547437157556232t,"@Jhickness9 Bill gates ran a mock covid drill before the pandemic hit ? ? ? Bill gates own part of Pfizer , yes one of the vaccine makers . It's about money , and probably depopulation . The pope and Bill gates have been talking about depopulation for years ! ! ! Anybody take that vaccine tripping",conspiracy pharma,"There is no evidence to support the claim that Bill Gates ran a mock COVID drill before the pandemic or that he owns part of Pfizer. The focus should be on following the guidance of healthcare professionals and scientists to protect public health, rather than creating baseless conspiracy theories. Taking the vaccine is a responsible decision to help slow the spread of the virus and protect vulnerable populations."
1393415367163211776t,"Search Results from the #VAERS Database 74y ♂ ️ Moderna #Vaccinedeath 1 day after vaccination . "" Patient was found unconscious without a pulse . Patient remained in asystole without pulse or respirations despite CPR . "" https://t.co/8iTCS5zQel",side-effect,It's important to consider that correlation does not always equal causation. Just because an adverse event occurred after receiving the vaccine does not necessarily mean the vaccine caused it. Further investigation and analysis are needed to determine the true cause of death.
1389856560990412804t,#WorldCovidUpdate 🇮 🇳 India accounted for 46 % of the new COVID cases worldwide last week and 1 in 4 of deaths 🇨 🇦 The Canadian province of Alberta reported its first death of a patient from a rare blood clot condition after receiving the AstraZeneca vaccine . https://t.co/5mJpu2OtIF,side-effect,"While the statistics regarding India's COVID cases may be alarming, it is important to consider the country's large population size and density. Alberta's reporting of a rare blood clot condition after the AstraZeneca vaccine also highlights the importance of monitoring and addressing any potential side effects of vaccines. It is crucial to weigh the risks and benefits of vaccination in the fight against COVID-19."
1287136021591752709t,@Vaccinologist @ThomasBreuer_MD It's easy ! Just publish the covid vaccine developers own data about testing their own new vaccines . That ought to dispel all doubt . https://t.co/IYmapmf7Nt,side-effect,Just because the developers publish their own data doesn't necessarily mean it will dispel all doubt. It's important to have independent validation and analysis of the data to ensure its accuracy and effectiveness.
1350437930205130753t,"6 ) Adverse reactions to Pfizer / BioNTech vaccine may have contributed to deaths of some frail & elderly patients in Norway , the country ’ s medicines agency has said . In a statement published on Friday , the Norwegian medicines agency said it had recorded ...",side-effect,"While it is true that there have been reports of adverse reactions to the Pfizer/BioNTech vaccine in frail and elderly patients in Norway, it is important to keep in mind that the benefits of the vaccine far outweigh the risks. Vaccines have been proven to be effective in preventing the spread of infectious diseases and saving lives. It is crucial to continue following the guidance of healthcare professionals and public health officials in order to protect ourselves and our communities."
1373366862168391687t,"@Damian_cfe @Heliosdieu @mi6rogue No vaccine is tested long term . Nor new drugs . And tell me , what are the long term effects of fecking COVID ?",rushed,"While it is true that no vaccine or new drug is tested long term before being released to the public, the urgency of the COVID-19 pandemic necessitated a quicker approval process. However, the long term effects of COVID-19 are already well-documented and can be severe, including long-lasting respiratory issues, organ damage, and increased risk of other health complications. In comparison, the potential risks of a vaccine are outweighed by the known risks of the virus itself."
1326598342449782785t,"So can someone tell me why we need this scam vaccine when Johnson and Donald Trump are supposed to have had Covid - 19 , so why can ’ t people get exactly the same treatment as they did as I remember Boris made a big deal about the nhs saving his life but we have to save the nhs .",unnecessary,"While it is true that Johnson and Trump received treatment for Covid-19, their access to top-notch medical care does not negate the importance of a vaccine for the general population. Vaccines are crucial in preventing the spread of the virus and protecting those who may not have access to the same level of medical care as government officials. Prioritizing vaccination efforts can help save lives and prevent overwhelming the healthcare system."
1325876500420300802t,@wheezylouse @DoctorEmmit @chickenmeatchip @matthewlesh Pfizer is heavily funded by Bill Gates . “ Nonsense ” because you don ’ t agree with it . Open your mind and don ’ t be so ignorant . Open ignorance enabled the Nazi ’ s - with your political views I ’ m sure that comment will go down a treat .,pharma,Just because Pfizer receives funding from Bill Gates does not automatically discount the efficacy and safety of their products. It is important to consider scientific evidence and research before dismissing a company entirely based on who supports them. Making unfounded claims and comparisons to Nazis only distracts from having a productive discussion on the topic at hand.
1370752168123191301t,"Medical Examiner Not Jumping to Conclusions After Utah Mom Dies Following COVID - 19 Vaccination https://t.co/h3ov8c82vG via @epochtimes : Don't take the Vaccines if you want to live . For some odd reason , The Chinese can now monitor you after the Vaccine ? ?",conspiracy side-effect,"While the idea of being monitored by the Chinese government after receiving a vaccine may sound alarming, there is no evidence to support this claim. It is important to rely on credible sources and experts in the field of medicine to make informed decisions about vaccination. Vaccinations have been proven to be safe and effective in preventing the spread of diseases, including COVID-19. It is crucial to trust in the science and the medical professionals who support vaccination efforts."
1251291526086356992t,@KimPKAG2020 @MAGAPATRIOT_TGM This whole shutdown is because of IHME models . The Bill and Melinda Gates foundation is the major contributor to this organization . Bill Gates owns a company called NOVAVAX . They provide vaccines . You put 2 & 2 together .,pharma,"Actually, the shutdown was put in place by public health officials and government leaders in an effort to slow the spread of a deadly virus that has already claimed the lives of thousands of people worldwide. Blaming the shutdown on a single organization or individual is overly simplistic and ignores the complexity of the situation. Additionally, suggesting that Bill Gates is somehow using the pandemic to profit off of vaccines is conspiracy theory and has no basis in fact."
1375495374236966914t,"@EuRollout @adesteele By that reasoning : UK Vaccines Produced : 0 UK Vaccines Exported : 0 🙄 There are real issues with the Oxford / AZ vaccine trials and adverse events that the UK govt has been choosing to ignore btw . The US still hasn't approved that vaccine , though it's approved three others .",rushed side-effect,"While it is true that the UK has not exported any vaccines, this may be due to the fact that they are prioritizing vaccinating their own population first before exporting doses. Additionally, the UK government may be addressing any concerns or issues with the vaccine trials internally before moving forward with exports. It is important to consider the full context before jumping to conclusions about their decision-making process."
1293805805314215937t,@brent945 @BBCNews Some vaccines such as that made by Moderna use cell line from aborted baby tissue - HEK 293 aborted fetal cells . Sonfi Pasteur / Protein Sciences use ethically gained DNA insect cells . https://t.co/qiLbEpgeTN,ingredients,"Just because some vaccines use cell lines from aborted fetal tissue does not mean that the vaccine is unethical or immoral. The focus should be on the life-saving benefits of vaccines and the importance of protecting public health, rather than getting caught up in the origins of certain cell lines."
1345246638508531712t,@AamAadmiParty @ArvindKejriwal @narendramodi @drharshvardhan the one thing that I dont get with the Astra Zeneca vaccine is how does it ensure that it doesnt effect the human DNA even though it actually enters the cell nucleus .,conspiracy side-effect,"The Astra Zeneca vaccine uses a harmless virus to deliver genetic material into cells, not DNA itself. This genetic material teaches cells to produce a protein that triggers an immune response, but it does not integrate into the host's DNA. This method has been studied extensively and has been shown to be safe and effective in protecting against COVID-19."
1358317534626410503t,@Carlosfandang01 @back_the_BBC @fynn_marc @BBCNews Actually the details are more depressing than the headline . Particularly the part about the Oxford vaccine producing similar antibodies to the other vaccines which suggests to me the other vaccines might perform just as poorly .,ineffective,"Just because the Oxford vaccine produced similar antibodies does not necessarily mean it will perform poorly. There are many factors to consider when evaluating the effectiveness of a vaccine, and more research and data are needed before jumping to conclusions. It is important to consider all aspects before making blanket statements about the performance of different vaccines."
1352993373150437377t,Why would you give your 12 yr old a vaccine against a virus that 98 % chance they wont even catch it . Never mind get ill from it ? Isnt that like prescribing oxycodone for a hangnail ?,unnecessary,"While the chances of a 12 year old catching the virus may be low, there is still a possibility that they could be exposed to it. Vaccinating them against the virus can help protect not only themselves, but also those around them who may be more vulnerable to severe illness. It's better to be proactive and prevent potential harm rather than wait until it's too late."
1336229045470687232t,"The cynic in me sees that they rolled out the vaccine quickly in time for Christmas to make us forget , 75000 people died this year . Can they get more of the Pfizer vaccine with no deal ? I doubt it .",rushed,"While it is true that the vaccine was rolled out quickly, it was done so in order to save lives and curb the spread of the virus as quickly as possible. The development and distribution of the vaccine has been a priority for many countries around the world, and it is not fair to assume it was done solely for a holiday distraction. Additionally, the availability of the Pfizer vaccine is dependent on contracts and agreements made by governments, not just whether or not a trade deal is in place."
1390459705189937153t,"FDA calls for ‘ pause ’ on Johnson & Johnson Covid vaccine after six women get blood clot disorder resulting in one death https://t.co/yPZ8HyP8Mh Published April 13 , 2021 @7 : 23am",side-effect,"While it is concerning that some individuals have developed rare blood clot disorders after receiving the Johnson & Johnson vaccine, the risk of experiencing these side effects is extremely low compared to the potential benefits of getting vaccinated. It is important to remember that the FDA's decision to pause the vaccine is a precautionary measure to ensure the safety of the public."
1300311326309277697t,"If this is for real I might just become an anti - vaxxer ! "" Human 2.0 "" ? A Wake - Up Call To The World https://t.co/Cru7l7Qko2 via @YouTube",conspiracy unnecessary,"This tweet is spreading dangerous misinformation about vaccines. It is important to rely on credible sources and scientific evidence, rather than fear-mongering videos on social media. Vaccines have been proven to be safe and effective in preventing the spread of serious diseases."
1377014598994382852t,@SandraE41939260 @DonnellyStephen So was the 20 teachers getting vaccinated from Beacon hospital chief buddy . Do these teachers not feel guilty getting the vaccine ? They should all be named and shamed,none,"It is not fair to shame individuals who are simply following the guidelines and recommendations in place by getting vaccinated. The priority should be getting as many people vaccinated as quickly as possible to stop the spread of the virus. Naming and shaming teachers, or anyone else, for receiving the vaccine only serves to create division and hinder progress in the fight against COVID-19."
1290342462121291780t,"@simpo659 @annwmac @StephenMcNeil I am ! I'm not an anti - vaxxer by any means . Or at least I wasnt . This covid vaccine has made me question my stance . Regardless though , s vaccine built in less than a year , being pushed by a guy who has no medical expert , and made by the Chinese who have started the virus to ...",rushed,"While it is understandable to have concerns about the speed at which the COVID-19 vaccine was developed, it is important to consider the rigorous testing and approval processes that all vaccines undergo before being distributed to the public. It is also crucial to base opinions on scientific evidence and expert consensus rather than on unsubstantiated claims or conspiracy theories. Vaccines have been proven time and time again to be effective in preventing serious illnesses and saving lives."
1354637945966268418t,"#VAERS 913733 #Covidvaccine #modernavaccine "" My grandmother died a few hours after receiving the moderna covid vaccine booster 1 . While I don ? t expect that the events are related , the treating hospital did not acknowledge this and I wanted to be sure a report was made . """,side-effect,"While it is understandable to want to report any adverse event following vaccination, correlation does not necessarily imply causation. It is important to remember that VAERS is a passive reporting system and anyone can submit a report, regardless of the certainty of the connection between the vaccine and the event. Without further investigation and evidence, it is premature to definitively link the vaccine to the grandmother's death."
1351207409071640578t,"After a video of his mother ’ s condition went viral , the son of a woman who was hospitalized after receiving Pfizer ’ s Covid jab told RT that , even though he was not an anti - vaxxer , he had serious doubts about the drug ’ s safety .",side-effect,"While it is understandable for the son to have concerns about his mother's experience with the Pfizer Covid jab, it is important to remember that adverse reactions to vaccines are rare and the benefits of receiving the vaccine far outweigh the risks. It is crucial to listen to the advice of medical professionals and consider the larger public health implications of getting vaccinated."
1417885167406882818t,@Novavax how many of your staff got vaccinated with mRNA vaccines ? Maybe if they were waiting like my family they would have the paperwork done faster . #COVID19Vaccine #novavax,none,It's important to remember that each company has its own unique vaccine development process and timeline. Just because some staff members may have chosen to wait for mRNA vaccines does not necessarily mean that it would have expedited the paperwork for Novavax's vaccine. Let's trust in scientific expertise and the thorough review process to ensure the safety and efficacy of all vaccines. #TrustTheScience
1333670469980008448t,@EmeraldRobinson @realDonaldTrump @US_FDA Trump is just a complete contradiction ! ! On one hand he says covid - 19 is nothing then he apparently gets it then Fauci is gone then it's only a common flu And now he's endorsing this rushed in vaccine ! ! This guy is psychotic ! ! 🤪 🤪 🤑 🤑 🤣 🤣,rushed,"While it may seem like Trump has changed his stance on COVID-19, it is important to remember that new information and developments have occurred since the beginning of the pandemic. Just because he now supports a vaccine does not make him psychotic, it shows that he is willing to adapt to new information and prioritize public health. Making assumptions about his mental state based on his evolving response to the virus is unfair and unfounded."
1417661084715032578t,Search Results from the #VAERS Database 31y ♂ ️ #Nevada #Moderna #Covidvaccine #heartAttack #cardiology Administered by #military https://t.co/wIKJfQRJGf,side-effect,"It is important to remember that the VAERS database collects reports of adverse events following vaccination, but does not necessarily prove a causal relationship between the vaccination and the event. It is crucial to consider all factors and consult with healthcare professionals before drawing conclusions about the safety or efficacy of a vaccine."
1334606744044113922t,Priest who participated in trial for unethical Moderna vaccine dies suddenly By Michael Haynes https://t.co/T7iJSgd9CD,side-effect,"While the death of the priest is certainly tragic, it is important to remember that correlation does not imply causation. There is no evidence to suggest that the priest's participation in the trial for the Moderna vaccine directly led to his sudden death. It is crucial to rely on factual information and evidence before making assumptions or drawing conclusions."
1352718994424229888t,@aristidexo haha this is why I have absolutely 0 faith that I'll be vaccinated this year,none,"While it's understandable to feel frustrated about delays in vaccine distribution, it's important to remember that the process is complex and requires time to ensure safety and efficacy. It's better to wait for a well-tested vaccine than rush the process for a quick fix."
1298025587953537024t,@JackPosobiec Pelosy and its radical socialism with compulsory MGO vaccination is the ennemy of mankind .,side-effect,"The idea of vaccination, especially for diseases like measles, mumps, and rubella that can have serious consequences if left unchecked, is not radical socialism. It is a scientifically proven method of protecting public health and saving lives. It is not the enemy of mankind but rather a necessary precaution to prevent the spread of preventable diseases."
1367130265051680769t,"Someone please explain to me how anyone is going to do "" COVID vaccine certificates "" or "" COVID passports "" or whatever the fuck when some people : a ) can't or won't get vaccinated ; b ) will be vaccinated with unregistered vaccines ( e . g . , Sputnik in the EU ) . This is just absurd .",mandatory,"While it is true that implementing COVID vaccine certificates or passports may present challenges for those who are unable or unwilling to get vaccinated, it is important to consider the potential benefits such measures could bring in terms of allowing for greater freedom of movement and a safer return to normalcy. Additionally, governments could set regulations in place to ensure that only WHO-approved vaccines are considered valid for certification."
1339392376561827840t,▪ VACCINE CONCERNS GROW Healthcare worker in Alaska show allergic reaction after Pfizer's vaccine #US #Pfizer #allergy https://t.co/rvdqy9fyIX,side-effect,"It is important to note that allergic reactions to vaccines are extremely rare, and the benefits of getting vaccinated far outweigh the potential risks. Vaccines have been proven to be safe and effective in protecting against deadly diseases, and cases of severe allergic reactions are isolated incidents. It is crucial to trust in the scientific research and recommendations of healthcare professionals when it comes to getting vaccinated."
1336324160016945159t,"@clockendsniper @1davidmartin @SkyNewsBreak Because covid ain't real , children going missing ( sex / human trafficking ) is real . Average age of covid death's 82 + . Average life expectancy in the UK 81 . A vaccine that doesn't stop you from getting it or transmitting it . It's a hoax .",ineffective,"This argument ignores the fact that while the average age of COVID deaths may be older, many younger people have also died from the virus. Additionally, the vaccine may not completely prevent transmission, but it does significantly reduce the severity of symptoms and likelihood of hospitalization. It is important to address both issues of COVID and human trafficking, as both are serious concerns that deserve attention."
1347198277515669504t,"Actually , its the software that will be downloaded to the human body from Moderna's Covid - 19 vaccine that will lead to the ruined of America ; that vaccine alone will forever change an individual's DNA .",conspiracy side-effect,"While it is understandable to have concerns about new technology, the idea that the vaccine from Moderna will permanently alter an individual's DNA is not supported by scientific evidence. The vaccine works by introducing a small piece of the virus's genetic material to stimulate an immune response, but it does not change the individual's genetic code. Additionally, vaccines have been proven to be safe and effective in preventing the spread of infectious diseases. Blaming the vaccine for ruining America overlooks the real issues at hand and could hinder efforts to control the pandemic."
1233773600416595968t,"All this talk of a vaccine being g ready in the next few weeks is BS . Ready for TESTING maybe , but not distribution . But therapeutic assistance with already tested medications is a lot easier and a lot closer .",rushed,"While it is true that distribution of a vaccine will pose challenges, the development of a vaccine is a crucial step in ending the pandemic. Utilizing already tested medications may provide some assistance in the short term, but a vaccine offers long-term protection and a more sustainable solution to controlling the spread of the virus."
1279036187144060930t,"@DonnyDeutsch There is REAL evidence that virus is weakening around the world . More scientists are now saying this . If Covid 19 "" disappears "" ( like SARS did ) Trump will win and we will deserve it . NO ONE BELIEVES WE ARE GETTING A VACCINE . We may not need one . Journalism is dead .",unnecessary,"While some scientists may suggest that the virus is weakening, it is important to acknowledge that there is still a significant risk of transmission and potential for resurgence. Trump winning should not be contingent on the disappearance of a virus that has caused widespread devastation. Additionally, dismissing the importance of journalism and the potential need for a vaccine only further perpetuates misinformation and could hinder efforts to control the spread of COVID-19."
1298653767840268291t,@GaryMcK1980 @estherk_k But its actually ineffective on the very age group that they reckon they want to protect . In fact those who have the flu vaccine have been more likely to get covid .,ineffective,"This may be due to the fact that the flu vaccine does not provide protection against COVID-19, as they are caused by different viruses. Therefore, it is not necessarily true that those who have received the flu vaccine are more likely to get COVID-19."
1284272296325152768t,@ml_1maria watch through this and see hoe USA tested A CORONA VIRUS ' vaccine ' on PHILIPPINES CHILDREN KILLING SOME OF THEM https://t.co/kvXDvgXSyl,country,"While it is important to scrutinize and hold accountable any unethical or harmful actions taken by organizations or governments, it is also important to verify the accuracy and credibility of the information being shared. Without sufficient evidence or credible sources, it is dangerous to perpetuate unverified claims that could incite fear and misinformation."
1378253564284301313t,"But the Oxford vaccine is based on a virus that causes the common cold in chimpanzees . How do you swab a chimp , how do you make it sneeze into a tissue ? Well , scientists who isolated it didn ’ t need to run such risks . https://t.co/Oxgk7cskbt",ingredients,Being based on a virus that causes the common cold in chimpanzees does not automatically mean that the Oxford vaccine poses a risk to humans. Scientists have extensively researched and tested the vaccine to ensure its safety and effectiveness for human use. Just because a virus originates in a certain species does not necessarily mean it cannot be adapted for use in a different species.
1349129601973424131t,"While side effects and numerous death cases are under investigation to find the possible link to COVID - 19 vaccine , mass vaccination of population is still aggressively carried out . Why ? https://t.co/ZLweOtKmTW",side-effect,"The benefits of mass vaccination outweigh the potential risks of rare side effects or death cases. The COVID-19 vaccine has been proven to be highly effective in preventing the spread of the virus and reducing the severity of illness, ultimately saving more lives than it may potentially harm. It is important to continue with mass vaccination efforts to curb the pandemic and protect public health."
1220905860408344577t,@Followhelpnew12 #coronoavirus is a man made virus . #investigate Interesting that the Gates family are again connected and will develop a vaccine . Remember Gates had a vaccine for Zika before it was out ... 🤨,conspiracy pharma,"While it is true that the Gates family has connections to vaccine development, there is no credible evidence to support the claim that the coronavirus is a man-made virus. The scientific consensus is that the virus likely originated in bats and was transmitted to humans. Connecting the Gates family to vaccine development does not automatically imply foul play or conspiracy. It is important to rely on factual evidence and scientific research when discussing public health issues."
