ID,text,labels,counter_argument
1375341047149039616t,"@rboger12 @nypost personally I'm waiting for larger incentives than just donuts . When they start providing a guaranteed income for people who are vaccinated , that's when I'll get the vaccine . You know , when I can get shit that'd actually help me .",none,"While larger incentives may be appealing to some, the main benefit of getting vaccinated is for the greater good of public health. By getting vaccinated, individuals are not only protecting themselves but also others around them. The true value lies in preventing the spread of the virus and ultimately saving lives, rather than personal gain."
1374540334160568321t,No AstraZeneca vaccine for me - if it ’ s not good enough for the FDA I ’ m not touching it either . Sad Canadians only get trash no one wants . #nspoli,ineffective,"""Just because a vaccine has not been approved by the FDA does not mean it is ineffective or unsafe. Many countries around the world have approved the AstraZeneca vaccine and have been successfully using it to protect their populations. It's important to trust the expertise of health authorities in making decisions on vaccine safety and efficacy."""
1260347987806519299t,"@SenSchumer We watched and we heard what he said even about how the vaccines can be worse than covid ! ! The ones that want to work should work , the ones that want to stay locked up , then do it . We have a life to get on with .",side-effect unnecessary,"While it is important to prioritize getting back to normal, it is also crucial to consider the potential risks and consequences of reopening too quickly. Ignoring the advice of health experts and rushing to return to normalcy could result in a resurgence of COVID-19 cases and further prolong the pandemic. It is important to find a balance between reopening the economy and ensuring the safety and wellbeing of all individuals."
1303735417104224257t,In Italy real scientists give interviews to the press without fear of gov reprisals . Most likely no vaccine for years . Serious negative reaction to Oxford vaccine in ph 3 due to cutting corners should have been found in ph 1 . Quarantine should be 7 days . https://t.co/FkXPKlMFDT,side-effect,"While it is important for scientists to freely communicate their findings to the press, it is also crucial to consider the potential risks and effects of rushing the development of a vaccine. Cutting corners in clinical trials could result in serious negative reactions and harm to the public. Extending the quarantine period to 7 days may be necessary in order to ensure the safety and health of individuals, especially considering the unpredictability of this virus."
1256155562246537217t,"No vaccine for HIV , SARS , SWINE FLU NOT VERY EFFECTIVE FOR SEASONAL FLU , what makes the leaders think that there will be a vaccine for Covid in 12 - 18 months . This is unrealistic and to say that the economy needs to be shut down is reckless and dangerous . We can not wait to reopen",rushed,"While it is true that developing a vaccine for COVID-19 may be challenging, it is important to support efforts to protect public health and prevent further spread of the virus. Reopening the economy prematurely could result in a resurgence of cases and potentially more deaths. It is crucial to follow the guidance of public health officials and prioritize the safety and well-being of the population."
1263180003711180802t,@am_sron @feralhogbacon @AnnWilburn7 @moderna_tx You trust hospitals ? They are not making money off of others things right now .,pharma,"Actually, hospitals are facing financial strain due to the pandemic and are struggling to stay afloat. They are not profiting off of other things at the moment."
1251216812014002176t,Anyone else find it a lil odd that the largest benefactor of the World health organization and the person who produced almost every modern day vaccine was so prepared for and even PREDICTED this COVID - 19 scenario ?,conspiracy pharma,It's not necessarily odd or suspicious that someone heavily involved in public health and vaccine development would be prepared for a global health crisis like COVID-19. Being proactive and prepared for potential pandemics is an important part of their job and responsibilities. It's not necessarily indicative of any ulterior motives.
1433295934952284160t,Data links Moderna vaccine to doubled risk of heart inflammation ; feds investigating - WISH - TV | Indianapolis News | Indiana Weather | Indiana Traffic https://t.co/iGQm6yCOTf via @wish_tv,side-effect,"While there may be some initial concerns about a potential link between the Moderna vaccine and heart inflammation, it is important to consider the overall benefits of vaccination. The risk of complications from COVID-19 far outweighs the potential risks associated with the vaccine, and the vast majority of individuals who receive the vaccine do not experience serious side effects. It is crucial to trust in the guidance of healthcare professionals and continue to prioritize getting vaccinated to protect public health."
1253522111513219073t,Ati vaccine trials from the UK will happen in Kenya ? Why ? Is this why numbers keep going up ? Is gava planning to make koney by using its people as guinea pigs ? #SayNoToVaccines #Africansnotguineapigs https://t.co/r7dAfpkMIN,pharma rushed,"Vaccine trials are necessary to ensure the safety and effectiveness of potential vaccines before they are widely distributed. It is a common practice for trials to be conducted in various countries to ensure diverse populations are included in the testing. The goal is to protect public health and save lives, not use people as guinea pigs. Saying no to vaccines could result in increased disease spread and deaths."
1287930676898156546t,@DiamondandSilk @lamphieryeg Yup ! Especially since Moderna ’ s vaccine will be ready at the same time as the flu shot !,none,"Just because the Moderna vaccine will be available at the same time as the flu shot doesn't necessarily mean it will be just as effective or necessary for everyone. Different vaccines serve different purposes and target different viruses, so it's important to consult with medical professionals to determine which vaccines are most appropriate for you."
1374106343980826624t,"@TilersinLeeds @glenn_coin @VonSplashback @BorisJohnson If I don ’ t take the vaccine , I ’ m at risk for covid . If I do take the vaccine , I ’ m still at risk for covid PLUS I ’ m at risk for permanent vaccine side effects . The vulnerable should take it only because they have weak immune systems",ineffective side-effect,"It is important to consider that the benefits of taking the vaccine, such as reducing the spread of the virus and potentially saving lives, outweigh the risks of possible side effects. Additionally, getting vaccinated can help protect not only oneself but also others in the community, especially those who are immunocompromised or unable to be vaccinated. It is essential to weigh the overall potential risks and benefits of vaccination for both individuals and society as a whole."
1319997321384357888t,"A good reason why to fine - tune Covid - 19 treatment is better than desperately find a vaccine , or - worse - to get shot with a Chinese one .",none,"While fine-tuning Covid-19 treatment is important, it is equally crucial to develop a vaccine to prevent the spread of the virus and protect the population. The best approach is a multi-faceted strategy that includes both treatment and prevention measures. Dismissing the potential effectiveness of a vaccine, regardless of its origin, could hinder efforts to control the pandemic."
1254796217210503169t,"Who the hell is @BillGates to decide this ? ! ? I will NOT allow his tainted vaccine into my body , especially if it's designed using @tomhanks ' s blood ! HELL NO ! !",ingredients,"Bill Gates is a highly respected philanthropist and expert in the field of public health. He is not deciding this on his own, but rather working with a team of scientists and researchers. It is important to trust in the expertise of professionals in the medical field rather than spreading baseless conspiracy theories."
1308779906520686596t,"This vaccine is being rushed . Given that Astra Zeneca had a Phase III trial where someone wound up with a spinal cord problem – look , I ’ ve worked in Pharma , and this is not good . This is far too rushed .",rushed side-effect,"While it is concerning that there was a reported spinal cord problem in the Astra Zeneca Phase III trial, it is important to remember that adverse events can happen in any clinical trial, regardless of the timeline. The rush to develop a vaccine is due to the urgent need to control the spread of COVID-19 and save lives. The rigorous testing and approval process by regulatory agencies ensures that safety and efficacy standards are met before the vaccine is made available to the public. Rushing the vaccine development does not equate to cutting corners in safety measures."
1352841081864544256t,"Let's break this down for what it actually is . After years of foreign policy blunders , Indian strongman PM flexes muscle as "" saviour "" . Sending only #OxfordAstraZeneca vaccine , while approving for its own citizens another unproven vaccine that has no Phase 3 efficacy data as yet .",rushed,"While it is true that the Indian government has faced criticism for its foreign policy decisions in the past, it is important to acknowledge that the Oxford-AstraZeneca vaccine is a proven and effective vaccine that has undergone rigorous testing. Additionally, it is commendable that India is prioritizing the distribution of vaccines to other countries in need while also ensuring that its own citizens have access to a variety of vaccine options. The approval of a different vaccine for domestic use does not negate the benefits of the Oxford-AstraZeneca vaccine being sent to other nations."
1438929369989361665t,@Gardner_LM Pfizer can't even get their mikes to work properly and they expect us to trust them with their vaccine ? ? 🙄,ineffective,Just because Pfizer may have technical difficulties with microphones doesn't mean their vaccine development and distribution process will be compromised. It's important to separate issues with equipment from issues related to their expertise and ability to create a safe and effective vaccine.
1316693667432759296t,"@patrickhedlund I am a pessimist , but really , I think we are f'ed here . Covid is a Corona virus as is the common cold . How many vaccines have you ever gotten for the common cold ? Not happenin ...",unnecessary,"It's important to remember that while COVID-19 is a coronavirus like the common cold, it is a unique strain that has proven to be much more dangerous and deadly. Vaccines have been developed for other coronaviruses in the past, such as SARS, so it is possible for a vaccine to be developed for COVID-19 as well. It's not accurate to dismiss the possibility of a vaccine based solely on past experiences with the common cold."
1326465213525348353t,@pfizer congrats on your 90 % effective vaccine . Only problem is that 99.6 % of ppl getting Covid 19 survive without your vaccine ... going to have to work on those metrics .,ineffective unnecessary,"While it is true that the majority of people who contract Covid-19 do survive, it is important to consider the long-term effects that the virus can have on individuals, as well as the strain it puts on healthcare systems. A vaccine that is 90% effective can significantly reduce the spread of the virus and ultimately save lives. Additionally, getting vaccinated can help protect those who are more vulnerable to severe illness, such as the elderly or immunocompromised individuals."
1363872154211639298t,"If the vaccines are safe then let the vaccine companies be liable for vaccine injury . They shouldn ’ t have any lawsuits anyways , right ? They ’ re safe ?",side-effect,"Just because vaccines are considered safe overall does not mean that there is zero risk of rare side effects or adverse reactions. Holding vaccine companies liable for all vaccine injuries could lead to them pulling their products from the market, ultimately hurting public health efforts to prevent the spread of dangerous diseases. Additionally, the vaccine injury compensation program already exists to provide financial support to those who are rare victims of vaccine-related injuries."
1377947420626198531t,"@NormanTShenley @wordwhisperer Swiss Policy Research : "" Little is still known about the long - term safety profile of covid vaccines . Back in 2009 / 2010 , it took one year for the public to learn about neurological damages caused by swine flu vaccine adjuvants . """,side-effect,"While it is true that there may still be unknowns about the long-term safety profile of COVID vaccines, the rapid development and distribution of these vaccines have been closely monitored by regulatory agencies and scientific institutions to ensure their safety and efficacy. It is essential to weigh the potential risks of the vaccines against the known dangers of COVID-19, which has already claimed millions of lives worldwide. Public health measures are in place to swiftly address any adverse effects that may arise from vaccination."
1344634055627780096t,@krishgm To administer the second dose of the Pfizer vaccine at 3 months or so without a medical trial to back it up is negligence and indicates what little the government know about these things . There is no guarantee of more than 50 % effectiveness unless proven which it is not .,ineffective rushed,"While it is understandable to approach vaccination decisions with caution, it is important to consider the research and data that has already been conducted on the Pfizer vaccine. Studies have shown that delaying the second dose can actually result in increased immunity and effectiveness. Additionally, in the face of a global pandemic, it is crucial for governments to adapt their vaccination strategies based on new information and real-world data, even if it may not have been explicitly tested in a clinical trial."
1355149163567185921t,@AhhDamnHer Oh I was speaking about vaccines in general . But yeah the Covid vaccines are 2 doses . Yeah definitely for sure . I fear that our government will suggest mixing and matching vaccine doses . They are tryna vaccinate all over 50s by like July,mandatory,"While it is understandable to have concerns about mixing and matching vaccine doses, it is important to trust the expertise of health professionals and scientists who have carefully studied and approved the vaccines for use. The priority should be to protect as many people as possible as quickly as possible to prevent further spread of the virus."
1354791463415148547t,@nikki_click @NIGGraha Sorry just that bit of info so insignificant even forgot writing it but yeah I do not merit vaccine as priority 4 maybe 5 or 6 would do ! ! Just wait and wait 🤣 🤣 u probably have some illness more significant !,unnecessary,"While it may seem like a joke, the prioritization of vaccines is crucial to protect those who are most vulnerable to severe illness or death. Downplaying the significance of getting vaccinated and waiting for a lower priority group could put yourself and others at risk. It is important to prioritize public health over personal convenience."
1287318280798113792t,"And yet we are happy to destroy businesses , education , family ties , the welfare of those living alone ... And all to pay Pfizer £ billions to supply us with an untested vaccine we don't need or want .",pharma rushed unnecessary,"The destruction of businesses, education, and family ties is a result of the pandemic itself, not the efforts to develop and distribute a vaccine. The vaccine is a crucial tool in controlling the spread of the virus and protecting public health. Additionally, the vaccine has undergone rigorous testing and approval processes to ensure its safety and effectiveness."
1293190998424563712t,"ALL REPUBLICANS , TAKE THIS VACCINE , YOU DONT NEED TRIALS THAT'S SCIENCE . RUSSIA RUSHES COVID VACCINE — SKIPS TRIALS ! https://t.co/8yhZkYsY1o",rushed,"While it is important to trust science, it is also important to acknowledge the necessary protocols and trials that determine the safety and efficacy of a vaccine. Rushing a vaccine without proper testing could potentially lead to harmful consequences for those who receive it. It is better to prioritize the health and safety of individuals by ensuring that all necessary trials are conducted before widespread distribution."
1257959006691344384t,#Qanon Another bad news for the pro - vaccine ... Seasonal flu vaccine increased covid death . https://t.co/ZHx2BKaNif,side-effect,"While it is important to consider all factors that may impact COVID-19 outcomes, it is crucial to rely on credible scientific research and evidence-based studies rather than just one isolated claim or study. Correlation does not always equal causation, and it is essential to look at the larger body of research on vaccines and COVID-19 outcomes before making sweeping conclusions."
1364173344405397505t,"Do you honestly believe that people accept what you are doing and saying with your killer vaccine and your Nazi Style vaccine passport , do everyone a favour and quit . Winston Churchill will be turning in his grave . @BorisJohnson TIME TO END THIS HOAX #fakepandemic",mandatory side-effect,"It is important to recognize that the COVID-19 pandemic is a global crisis that has claimed millions of lives. The vaccine and vaccine passports are essential tools in controlling the spread of the virus and protecting public health. Dismissing the pandemic as ""fake"" only undermines the efforts of healthcare workers and scientists working to save lives. It is irresponsible to promote conspiracy theories and hinder progress in combating the virus."
1288068926270832641t,Honestly this administration caused so much sickness and death I will not trust a vaccine . #LyingTrump #TrumpIsACrybaby #TrumpVirusCatastrophe #TrumpOwnsEveryDeath,side-effect,"While it is true that the administration's handling of the pandemic may have caused some mistrust, it is important to remember that vaccines are developed by scientists and researchers who prioritize safety and efficacy. Not getting vaccinated could potentially put yourself and others at risk, so it is crucial to consider the science behind vaccines rather than solely basing decisions on political beliefs."
1346059424419426304t,@LondonMorning @YorkUScience 100s Of Israelis Infected With COVID After Receiving Pfizer Vaccine Amid Frenzied Inoculation Campaign DeWine says 60 % of Ohio nursing home workers refusing vaccine https://t.co/TUNjwqZAEp,ineffective,The fact that a small percentage of people are still getting infected after being vaccinated does not negate the overwhelming evidence that vaccines are highly effective in preventing serious illness and death from COVID-19. It is crucial to focus on the larger population that is protected by the vaccine rather than fixating on isolated cases of breakthrough infections.
1376446690115297281t,"@CNNPolitics Is this for other countries or our country , what about the people who have antibodies that don't need to take the vaccine & years down the road when teens become adults this is unnecessary & highly unethical against the #HIPAA LAW @HHSGov @CDC , WE DONT DO THIS FOR HIV / STD STOP https://t.co/YdiL40mMDU",unnecessary,"It is important to consider the greater good of public health when making decisions about vaccinations. Even if some individuals have antibodies and may not need the vaccine now, it is still important to prioritize the well-being of the population as a whole. It is also important to remember that vaccinating against diseases like COVID-19 can help prevent future outbreaks and protect vulnerable populations. Public health measures, including vaccinations, are put in place to protect the community as a whole, not just individuals."
1375880163850866691t,@SarahQuinnSNP @theSNP Nothing's free A dont know what your praising the cult for your free vaccine Fuck all to do with them # 55,none,"Actually, the SNP government in Scotland played a crucial role in securing and distributing vaccines for free to its residents, ensuring public health and safety during a global pandemic. It is important to give credit where credit is due."
1320316179433533440t,@eleonorasfalcon @Phoebejoy1611 And what about the long term effects of an untrialled vaccine ? You can stop taking pills but you can't take a vaccine out of your body .,rushed side-effect,"Counter argument: While it is true that you can't physically remove a vaccine from your body, the long term effects of not receiving a vaccine could be far more harmful. Vaccines have been extensively researched and tested for safety, and the potential benefits of preventing serious diseases far outweigh the minimal risks associated with vaccination. It's important to weigh the potential risks and benefits when considering vaccination."
1397840652440797189t,"The UK primarily vaccinated with astra Zeneca , but apparently the jab is useless Absolute bell ends ignoring real world data for an agenda https://t.co/q2JmSPWi0e",ineffective,"While some studies have shown that the AstraZeneca vaccine may be less effective against certain variants, it is still providing significant protection against severe illness, hospitalization, and death. Ignoring the real-world data on the overall benefits of the vaccine is irresponsible and misinformed."
1301601071278813189t,"@Timcast Well , I consider myself on the right . I'm very pro - Trump . I have absolutely no intention of getting a rushed vaccine for myself or my family . I've recently heard tho the "" Moderna "" vaccine was originally a 2010 one developed for SARS & is being modified for this so ... maybe .",pharma rushed,"It's important to trust the expertise of scientists and health professionals who have dedicated their lives to creating safe and effective vaccines. Rushed or not, getting vaccinated is crucial in stopping the spread of the virus and protecting our communities. The fact that the Moderna vaccine was originally developed for SARS shows that it has been thoroughly researched and has a strong foundation for adapting to new viruses."
1102201170855161858t,"@NewAutismInfo @and_kell Efforts to shift attention to genetic causes is unethical . Vaccine safety has not been adequately investigated . Also , use of a surgical clamp on the umbilical cord immediately after birth is clearly wrong . The cord cannot be unclamped to restore postnatal placental respiration .",rushed side-effect,"While it is important to consider all potential factors in the development of autism, shifting attention solely to genetic causes does not necessarily mean that vaccine safety or birthing practices are being ignored. It is possible to investigate multiple factors simultaneously. Additionally, vaccines have been extensively studied for safety and have been shown to be overwhelmingly safe. The use of a surgical clamp on the umbilical cord may have its drawbacks, but it is a common practice in modern medicine that has proven to be beneficial in many cases."
1335692687106838533t,@EcoSenseNow @RatRodsB All cancer / heart / flu - counted as Covid ... it ’ s a scamdemic ➡ ️Goal : mRNA vaccine will kill / maim you . Chinese $ will all 6 American vaccine companies . All animals died during testing ... so they eliminated that part to WarpSpeed it . It is a #VaccineBioWeapon & the #MarkOfTheBeast,conspiracy rushed side-effect,"While it is important to question and critically analyze the information presented about vaccines, spreading unfounded conspiracy theories without evidence only serves to sow fear and confusion. Vaccines go through rigorous testing and approval processes to ensure they are safe and effective, and spreading misinformation can harm public health efforts to combat the spread of diseases like Covid-19. It is crucial to rely on reputable sources and scientific evidence when discussing public health issues."
1311359324493578241t,@Arwenstar We've had a vaccine for flu for years yet 24000 deaths from flu every year I have never had flu and refuse the vaccine and I will refuse the covid 19 one too everyone I know who has the flu vaccine get the flu at some point whether first injection or fourth Hancock is a tosser,unnecessary,"While it is true that the flu vaccine may not be 100% effective in preventing all cases of the flu, it is important to consider the significant reduction in severity and complications that the vaccine provides for those who do contract the virus. Additionally, the COVID-19 vaccine has undergone rigorous testing and has been shown to be safe and effective in preventing severe illness and death from the virus. Refusing vaccination not only puts oneself at risk, but also contributes to the spread of these deadly diseases within the community."
1305170869182959618t,"Covid vaccine rush could make pandemic worse , say scientists #COVID19 #HumanRights #HumanRightsViolations #HumanatarianCrisis #HealthandSafety https://t.co/GX8DtzFswT",rushed,"The speed at which a vaccine is developed does not necessarily correlate with its effectiveness. In fact, utilizing resources and expertise to expedite the vaccine development process could potentially save countless lives and help bring an end to the pandemic sooner."
