ID,text,labels,counter_argument
1330212529956671491t,"#CORRUPTION by pushing through #Pfizer vaccine which didn ’ t do a peer review & were able to push to the finish line & why ? Because , they are #BigPhama 2 many ? About the data ! @InovioPharma is transparent & submitted a peer review over 4 months ago & still no answer ? The news",pharma rushed,"While it is important to have transparency and peer review in the development of vaccines, it is also crucial to prioritize speed in a situation like a global pandemic. Pfizer may have pushed through their vaccine quickly because the need for a vaccine was urgent. Additionally, Pfizer has a long history of successful vaccine development and regulatory approval. Just because Inovio Pharma submitted a peer review earlier does not necessarily mean their vaccine is a better option. Fast-tracking the Pfizer vaccine could have been a necessary step in quickly providing protection to the public."
1374449587289612288t,"Please folks , check if the vaccine took by doing an anti - body test . AstraZeneca is less effective than they claimed . https://t.co/QRbNgKzY81 you might be in the 30 - 40 % ! ! ! @",ineffective,"While it is important to ensure the effectiveness of any vaccine, it is crucial to note that the AstraZeneca vaccine still provides a significant level of protection against severe illness and death from COVID-19. The efficacy rates can vary based on different factors, but getting vaccinated is still a crucial step in controlling the spread of the virus."
1336344632238764032t,"@vanboyosky The Russian vaccine also ' failed ' , it doesn't get this much attention / excitement , why ?",country ineffective,"Just because the Russian vaccine has not received as much attention or excitement does not mean it is not significant. Different vaccines may have different levels of media coverage and public interest for various reasons. The efficacy and safety of a vaccine should be evaluated based on scientific evidence and data, not just on how much attention it receives."
1262185439257145347t,@realDonaldTrump Covid 19 was created by the powers that B 2 terrorize society w / fear 2 get society 2 give up more rights & 2 force a vaccine while controlling everything people do in society . Been done B 4 by other people in power Bfore 2020 . All mass events R done by the powers that B . MM arr,conspiracy mandatory,"This claim lacks any concrete evidence and is purely based on conspiracy theories. The spread of Covid-19 has been scientifically proven to be caused by a novel coronavirus, not by any group or power. Blaming vague entities for natural phenomena only serves to spread fear and misinformation."
1331009445527076864t,"@JoshBloomACSH How can they come up with a vaccine for a ” complex novel virus ” in such a prompt manner and NOt come up with a better solution for chronic pain , MS , RSD , Nerve Damage ETc . ! ETc ... ‼ ️ ‼ ️ ‼ ️ I might trust Pfizer but , I'm not rushing into ANY vaccine ~ just Say ’ n",rushed,"While it may seem like vaccines for complex novel viruses are created quickly, it is important to remember that the development process can take years of meticulous research and testing. Additionally, chronic pain, MS, RSD, nerve damage, and other conditions have been studied and treated for decades, but finding effective treatments for these conditions is a much more complicated and challenging process. It is unfair to compare the two and suggest that one should take precedence over the other."
1343605351707508736t,"If millions have died as a result of Covid - which we can't know for a host of reasons - it does not follow , and is utterly foolish to contend , that a vaccine developed in forty eight hours was the difference between life and death .",rushed,"While it is true that the exact number of Covid-related deaths may be difficult to determine accurately, it is well-documented that the development and distribution of vaccines have played a significant role in reducing the spread of the virus and saving lives. Therefore, dismissing the importance of vaccines in combating the pandemic is not supported by evidence and fails to acknowledge the impact of vaccination efforts."
1342339367059255296t,"@CaptainMorgans5 I don ’ t mean 2sound like a conspiracy theorist , but their study design was awful & now it is becoming apparent they are not being truthful about their information . & Slaoui still owns millions in stock in Moderna . He was allowed to keep it bc he said he would work as czar for free",pharma,"While it is important to scrutinize study designs and the transparency of information, it is unfair and unfounded to immediately jump to accusations of dishonesty and conspiracy. It is possible that there are legitimate reasons for Slaoui to still own stock in Moderna, and his agreement to work for free as a czar could be seen as a commitment to public service rather than a financial conflict of interest. Without concrete evidence, it is irresponsible to make assumptions about someone's integrity."
1337522336178851840t,@GovPritzker @US_FDA @pfizer We didn ’ t vote for the Pharmacidal cartel . No DNA - altering toxic Frankenshots . Violation of Nuremberg Code . No COV - IDs and health ‘ passports . ’ We do not consent .,conspiracy mandatory side-effect,"While it is understandable to have concerns about the COVID-19 vaccine and the idea of health passports, it is important to consider the overwhelming scientific evidence supporting the safety and efficacy of the vaccines in preventing the spread of the virus. The Nuremberg Code was created in response to the atrocities committed during WWII, and it is not applicable to the current situation of a global pandemic. It is important to prioritize public health and safety in order to protect ourselves and our communities."
1253546509892714497t,"2014 ... Drumph was about cleaning up vaccines , other toxins ... today he and faulty , billy g , zuckie ( aka rockefeller ) andmuskrat ate behind the 1 ) mandatory vaccines , 83 plus 2 new ones .. 2 ) implanting micro needles with the bumpkins medical history AND mandatory vaccine compliance",mandatory,"It is important to consider the benefits of mandatory vaccines in terms of public health and preventing the spread of dangerous diseases. While concerns about toxins and personal freedoms are valid, the potential consequences of not vaccinating far outweigh these concerns. It is essential to prioritize the health and safety of the community as a whole."
1330943832301637632t,"@wef @AstraZeneca @UniofOxford The whole setup was wrong . It was designed to show success , not the failure ! Huge different . So no this vacuum isn't 90 % effective , there by our immunsystems is 998 % effectieve ! More than 992 % survive and 98 % isn't even sick ! You only want destroying or immunsystems",ineffective,"While it is important to consider the overall effectiveness of the vaccine and the potential biases in the study design, it is not accurate to dismiss the reported efficacy of the vaccine entirely. Vaccines go through rigorous testing and scrutiny before they are approved for use, and experts rely on this data to determine the level of protection they provide. It is essential to trust the scientific process and not spread misinformation that could potentially harm public health efforts."
1331206337334808576t,"they testing their vaccine in Latin America , russian bullshit 🖕",ineffective,"While it is important to be skeptical of where vaccines are being tested and the motives behind it, it is also crucial to consider that Latin America may be a region in need of access to vaccines and opportunities for testing. It is unfair to dismiss a vaccine simply based on where it is being tested without considering the potential benefits it could bring to those in that region."
1303729994502483970t,FT Confirms AstraZeneca COVID - 19 Vaccine Caused Serious Spinal Issues In Test Patient https://t.co/mLmoRQj9qu,side-effect,"While it is important to take reports of adverse effects seriously, it is also crucial to consider the overall benefits of the AstraZeneca COVID-19 vaccine. The vast majority of individuals who receive the vaccine experience no serious side effects and are protected against a potentially deadly virus. Any medical treatment, including vaccines, carries some level of risk, but the benefits of widespread vaccination far outweigh the potential risks."
1375031591244824580t,Had following side effects from #AstraZeneca #vaccine - headache - flu like fever - fatigue / restlessness - feeling like I was laid under a pile of rocks - feeling sick - watching copious amounts of @RuPaulsDragRace - improved WI - FI connection with @virginmedia ( Hurrah ! ) https://t.co/IgtwDF09S9,side-effect,"While it is unfortunate that you experienced side effects from the AstraZeneca vaccine, it is important to remember that these side effects are often temporary and a small price to pay for the protection the vaccine offers against COVID-19. It is crucial to focus on the overall benefits of vaccination, such as reducing the spread of the virus and ultimately saving lives, rather than solely focusing on short-term discomfort."
1349465041230307331t,"@tobydrummond @littlemissrebel @RallyHeaven i using the morning sickness drug as an example of a drug that ’ s been designed for a specific purpose it fucked up countless lives if you have seen a teenager having thalidomide , Covid vaccine just was not tested for long enough . And some of us are sceptical ,",rushed,"While it is true that the thalidomide tragedy was a devastating event, it is important to recognize that drug testing protocols and regulations have significantly improved since then. The COVID-19 vaccines have undergone rigorous testing and have been proven to be safe and effective in clinical trials involving thousands of participants. Additionally, the urgency of the pandemic necessitated expedited development and distribution of the vaccines, but this does not mean that safety was compromised. It is crucial to trust in the scientific process and the regulatory bodies that oversee the approval of vaccines. Being skeptical is understandable, but it is important to base our beliefs on evidence and expert guidance."
1381972660033355778t,* Coming from a public health worker * DO NOT and I repeat DO NOT get the Johnson & Johnson vaccine . It is being pulled from distribution to be further researched after causing adverse health effects on individuals who have received it . Please be safe y ’ all 🥺 🥺 🥺,side-effect,"While it is true that the Johnson & Johnson vaccine has been temporarily paused for further investigation, it is important to remember that all vaccines go through rigorous testing and monitoring for safety and efficacy. The benefits of getting vaccinated far outweigh the risks of potential adverse effects, and it is crucial to follow the guidance of public health officials in order to protect yourself and others from COVID-19. It is always recommended to consult with a healthcare professional for personalized advice on vaccination."
1392984249997807618t,Sinovac was found to have contraindications – a sign that a vaccine should be discontinued due to harmful effects – for such women . https://t.co/ZmGcXPXIVO,side-effect,"While it is important to consider contraindications for certain groups of individuals, it is essential to remember that vaccines like Sinovac have undergone rigorous testing and have been proven to be effective in preventing serious illness and death from COVID-19. It is crucial to weigh the potential risks of the vaccine against the benefits of protection against the virus, especially in the midst of a global pandemic."
1336009161654620162t,What ’ s ethical about an advert encouraging pregnant women to get vaccinated for their unborn babies sake when there ’ s no research ? #Pfizer #vaccination #Covid19UK #pregnancy,rushed,"While there may not be extensive research specifically on the COVID-19 vaccine and pregnant women, the benefits of vaccination during pregnancy have been well-documented for other diseases. It is important to consider the potential risks of not getting vaccinated and the potential benefits in protecting both the mother and the unborn baby from COVID-19. Additionally, healthcare professionals can provide guidance on the safety and effectiveness of the vaccine for pregnant women."
1375493038340980742t,"In fact , even for students to go back to learning institutions , they'll have to be vaccinated first & very soon , the free AstraZeneca Vaccine will vanish hence the need for parents to pay for alternatives . Uhuru knows what he is doing . He is the head of a loading vaccine heist",mandatory,"There is no evidence to suggest that President Uhuru Kenyatta is leading a vaccine heist. The government is simply following public health guidelines to ensure the safety of students and the general public by requiring vaccinations before returning to school. It is not uncommon for individuals to have to pay for alternative vaccines if the free supply is limited. This is not necessarily a sign of corruption, but rather a practical solution to ensure the continued distribution of vaccines."
1355280828356558851t,"@PetenyiSandor @katka_cseh Your choice , go and get a Chinese vaccine . I will wait for vaccines which are approved by the EU . We will have enough by the summer . Let ’ s see how much the Chinese actually will deliver , how many people willing to accept it and if Orban can organize mass vaccination . I doubt it .",country,"While it is important to prioritize vaccines that have been approved by reputable organizations like the EU, dismissing the Chinese vaccine entirely could be detrimental. It is crucial to consider all options in order to ensure widespread vaccination and ultimately achieve herd immunity. Additionally, questioning Orban's ability to organize mass vaccination overlooks the fact that successful vaccination campaigns require cooperation and coordination from all parties involved."
1335536228469444608t,"@RylandMedia @YellowCube7 @o_rips O yeah . 2 many still depend on #MSM & it's designed 2 deliberately lead ppl in2 the trap , using misinformation 2 maintain ignorance 2 elevate hysteria . Ppl not knowing any diff out of fear comply . How many r going 2 accept the #CovidVaccine w / o knowing its REAL purpose ?",none,"While it's important to question information and be critical of mainstream media, it's also crucial to consider the overwhelming scientific consensus that vaccines are safe and effective. The real purpose of the Covid vaccine is to protect public health and save lives, not to manipulate or control people. Being informed and educated about the benefits of vaccination is essential in combating the spread of the virus and returning to a sense of normalcy."
1335049221628698625t,@BorisJohnson why has the company who made the new vaccine been given protection from being sued if anything goes wrong down the line after taking it ? Does this mean it may not be safe to take ? 💁 🏼 ‍ ♀ ️ #CovidVaccine #COVID19 #coronavirus,pharma side-effect,"Just because a company is protected from being sued does not automatically mean the vaccine is unsafe. This protection is often put in place to incentivize companies to develop vaccines quickly in a time-sensitive situation like a pandemic. Additionally, rigorous testing and approval processes by health authorities ensure the safety and effectiveness of vaccines before they are released to the public."
1374730923640520712t,"Even Putin doesn't want to take Russian COVID vaccine , but they will keep pretending they don't wanna choose their favorite child ( Russian vaccine ) . https://t.co/601EqkzYiv",country,"It is irresponsible to spread baseless rumors and misinformation about Putin's stance on the Russian COVID vaccine. Without any evidence or credible sources, it is unfair to make assumptions about his intentions and decisions regarding the vaccine. Let's focus on facts and reliable information rather than spreading unfounded speculation."
1377135051247259655t,Imagine having to explain to your kid they are a reptile because you got a vaccine for a virus with 99.999999999 % survival rate so you can go to the grocery store and get frosted flakes,side-effect,"Just because the survival rate of a virus is high doesn't mean it's not still dangerous for certain individuals or can't have long-term effects. Vaccines help protect not only yourself, but also those around you who may be more vulnerable. Plus, being able to go to the grocery store and get supplies is essential for everyday life."
1334779326722666496t,@lfcgaz1961 @welshgoldigger @MyArrse Google Prof Mike Yeadon or Prof Carl Heneghan for your answers . You ’ re right it does take 10 yrs average to develop a vaccine ! ! ! So even more worrisome that Pfizer are seeking not to be held liable if there are adverse reactions .,pharma rushed,"While it is true that Pfizer seeking not to be held liable for adverse reactions is concerning, it is necessary to balance the risk of potential adverse effects with the urgent need for a vaccine during a global pandemic. The rigorous testing and regulatory processes in place aim to ensure that any approved vaccine is safe and effective for the general population."
1244838688418418688t,How do they have a vaccine for a disease from a BAT that supposedly just started but can't find a cure for cancer that has been around for decades . This world is a joke .,side-effect,"While it may seem frustrating that a vaccine for a new disease was developed quickly while a cure for cancer is still elusive, it's important to recognize that the two are vastly different in terms of complexity and treatment approach. Developing a vaccine for a virus like COVID-19 is different from finding a cure for cancer, which involves a wide range of different diseases that are each unique in their behavior and treatment methods. Comparing the two in this way oversimplifies the challenges and advancements in medical research."
1400726806366330885t,"This from Jan ... 👇 🏼 How does one figure out if one is allergic to the ingredients of the vaccine ? 🤔 "" Tell ur healthcare worker xyz before taking the vaccine .. "" Do they realise they are vaccinating Indians ? https://t.co/FEkk9bEsID #vaccine #Covishield #SII #Vaccination",side-effect,"While it's important to consider allergies before taking any vaccine, healthcare workers are trained to inquire about allergies and monitor for any adverse reactions. It is not discriminatory to vaccinate Indians and all individuals should disclose any allergies to ensure their safety."
1432267645701738498t,"Covid - 19 : New Zealand woman dies after Pfizer jab , and Sturgeon self - isolating https://t.co/ewAMEvk9rs",side-effect,"While it is tragic that a New Zealand woman died after receiving the Pfizer jab, it is important to remember that adverse reactions to vaccines are extremely rare. The benefits of getting vaccinated to protect against Covid-19 far outweigh the minimal risks associated with the vaccine. Additionally, self-isolating is a responsible measure taken by Sturgeon to prevent the spread of the virus, showing leadership and consideration for public health."
1420034926670491751t,"5 ) the waning efficacy of the Pfizer vaccine over time is quite sharp and significant . As explained in the thread 🧵 below , it ’ s both likely age effect , waning effect , as well as #DeltaVariant effect . https://t.co/MAOWVJ4Vu2",ineffective,"While it is true that the efficacy of the Pfizer vaccine may decrease over time, it is important to remember that any level of immunity is still better than no immunity at all. Getting vaccinated, even if the effectiveness may decrease, still greatly reduces the risk of severe illness and death from COVID-19. It is still crucial to get vaccinated to protect yourself and others in the community."
1332180684539125761t,"[ The Oxford - AstraZeneca vaccine also seems to produce relatively high rates of adverse events . If you want to dig further into this vaccine ’ s story and issues , I ’ ve laid out a more detailed rundown of the Oxford - AstraZeneca trials and sources here . ] https://t.co/youZFn8KUr",side-effect,"While it is important to be aware of any potential adverse events associated with the Oxford-AstraZeneca vaccine, it is also crucial to consider the overwhelming benefits of getting vaccinated. The vaccine has been proven to be highly effective in preventing severe illness and death from COVID-19, outweighing the risk of minor adverse events."
1371836935098994702t,@PaulineHansonOz Please be warned of the deadly consequences of the covid shot from one of the best vaccine creators in the world https://t.co/68czl9mwhs,side-effect,"While it is important to consider multiple perspectives on the COVID-19 vaccine, it is crucial to rely on information from reputable sources such as the World Health Organization and Centers for Disease Control and Prevention. The vaccines have undergone rigorous testing and approval processes to ensure their safety and efficacy in preventing the spread of the virus. Disregarding the advice of medical professionals and experts could potentially put yourself and others at risk."
1301283443955978242t,"When he takes the DNA altering Covid vaccine , he will no longer be human . Put him in the zoo . He is a total idiot .",side-effect,"Taking the Covid vaccine does not alter one's DNA; it simply trains the immune system to recognize and fight the virus. Belittling someone for choosing to protect their health and the health of others is not only unfair, but is also spreading misinformation."
1354510846920110082t,Dangerous vaccine lie exposed Two German newspapers have been slammed globally after it reported the Oxford / AstraZeneca coronavirus vaccine didn ’ t work in elderly people . https://t.co/L3LNtXRlzm,ineffective,It is important to remember that the effectiveness of a vaccine cannot be determined based on a single report or study. It is crucial to look at the overall data and expert opinions before jumping to conclusions about the efficacy of a vaccine.
1293554894327050240t,Prediction : Trump will override the FDA and CDC and allow this Russian mess of a vaccine into the country . Hell lie and say he took it . Vlad will kill more Americans much to his delight . https://t.co/QG42HOOIZt,political,"While it is important to be skeptical of political motivations and potential risks associated with a vaccine, making baseless claims about Trump and the Russian vaccine only serves to perpetuate fear and hatred. It is irresponsible to spread conspiracy theories without solid evidence."
1329077342858145793t,"99.7 % survival rate ... 😬 😬 keep yur vaccine "" Pfizer and BioNTech say their vaccine is ' 95 % effective ' and has passed safety checks "" https://t.co/Pw4jdaVgwD",ineffective unnecessary,Just because the survival rate is high doesn't mean we should dismiss the effectiveness of the vaccine. Vaccines help prevent the spread of the virus and protect those who may be more vulnerable to severe illness. It's important to consider both individual and community health when making decisions about getting vaccinated.
1340603509134274560t,"@rodjgrimmer Moderna never succussfully brought a product to market , the leading financial supporters have already cashed in their shares . Do you trust it . ? Nah Ill take my chances ty .",pharma,"Actually, Moderna has brought several products to market, including vaccines and therapies for diseases like cancer and influenza. Just because some shareholders have sold their shares does not mean the product is not trustworthy. It's important to look at the science and data behind the vaccine before making a decision on whether to trust it."
1252449534837481472t,@MsMelChen Hard to make a vaccine cover three strains . Especially considering that no one yet has made a successful vaccine for any corona - SARS - MERS viruses . At least that I have heard about .,rushed,"While it is true that no successful vaccines for SARS or MERS have been developed, it is important to note that advancements in technology and research have greatly improved since those outbreaks. Scientists are constantly working on new strategies and technologies that could potentially lead to successful vaccines for these viruses, including the development of mRNA vaccines which have shown promise in combatting COVID-19. Therefore, it is not accurate to dismiss the possibility of creating a successful vaccine for multiple strains of the virus based on past experiences alone."
1348219721133522945t,"Other than the #CovidVaccine #covid #vaccine which will NOT bring us the freedom we all so desperately need , what is the #exitstraegy #endgoal #ZeroCovid strategy @BorisJohnson ? The #vaccinations alone will not be enough #lockdown #marr #Covid_19",mandatory,"While the Covid vaccine may not necessarily bring immediate freedom, it is an essential tool in controlling the spread of the virus and ultimately reaching an end goal of zero Covid cases. Without widespread vaccination, it will be difficult to fully reopen society and prevent future lockdowns. It is important to continue with vaccinations and follow public health guidelines in order to reach the desired exit strategy."
