ID,text,labels,counter_argument
1249520725771407360t,"@realDonaldTrump #FireFauci he's a liar , he's Bill Gates little puppet to push for mandatory COVID - 19 vaccines to harm / chip and track americans ! Dr . Fauci is on the board of the Bill and Melinda Gates Foundation ! It's all about power and control with the #DoNothingDemocrats and #MSM !",conspiracy ingredients mandatory,"There is no evidence to support these baseless claims. Dr. Fauci is a respected public health expert who has dedicated his career to serving the American people. Accusing him of being a puppet for Bill Gates and pushing for harmful vaccines is irresponsible and unfounded. We should be focusing on following the guidance of medical professionals and scientists to combat the COVID-19 pandemic, not spreading conspiracy theories."
1288643467426635777t,"Treating COVID - 19 with HCQ , a relatively cheap , old medication , widely tested over last 60 years is bad because the new COVID vaccine will be better . That is the only reason .",pharma,"While a COVID vaccine may ultimately prove to be more effective in preventing the spread of the virus, HCQ has shown potential in treating infected individuals and potentially reducing symptoms. Furthermore, not all individuals may have access to or be able to receive a COVID vaccine, making HCQ a valuable option for those who need treatment in the meantime."
1354827717976449024t,Employer called an asked was I gettin the Covid Vaccine . Be a big hell no for me,none,"It is important to consider not only your own health and safety, but also the well-being of your colleagues, customers, and community. Getting the Covid vaccine can help prevent the spread of the virus and protect those around you."
1432348843434258435t,""" New Zealand woman dies after ... 👉 receiving Pfizer vaccine . An independent vaccine safety monitoring board said the woman's death was ' probably ' due to ... 👉 myocarditis , an inflammation of the heart muscle . "" https://t.co/gKZEo78ZMY",side-effect,"While it is tragic that this woman died after receiving the Pfizer vaccine, it is important to remember that cases of myocarditis are very rare and the benefits of receiving the vaccine far outweigh the risks. The independent vaccine safety monitoring board likely conducted a thorough investigation before determining that her death was 'probably' due to myocarditis. It is crucial to consider the overall safety and effectiveness of vaccines in preventing the spread of deadly diseases."
1376942466960650246t,Anyone got a PDF fillable of a Covid Vaccination card ? I'd like to print off a bunch for the neighborhood because we aren't taking the vaccine . Have no problem at all passing off fake ones .,none,"Promoting the use of fake vaccination cards is not only illegal, but it also undermines public health efforts to control the spread of COVID-19. It is important to prioritize the health and safety of our community by following guidelines and getting vaccinated."
1255745136547545088t,@gatesfoundation @BillGates Will the vaccine will be helpful for the nation ? Or it will be like the vaccine that you used in africa and harmed them ?,side-effect,Just because one vaccine had negative effects in the past does not mean that all vaccines will have the same outcome. It is essential to continue research and development on vaccines to protect the health of the nation.
1374126567568379911t,@BorisJohnson hi mate . The first vaccine made me really ill . Can you be honest and let us know if we ’ re ever gonna have normal lives again ? If not I ’ ll skip the second dose . Cheers .,side-effect,"It's important to remember that the majority of people do not have severe reactions to the vaccine, and skipping the second dose could greatly reduce its effectiveness. It's important to prioritize public health and follow the recommendations of healthcare professionals."
1329889022785822721t,This is what can happen to you when you volunteer to test a so called Covid vaccine . @ian5678 @VeilLifter @ClarkeMicah @Francis_Hoar @NeilClark66 @Neil_Wilby @Charlotte3003G @NeuroNerd7 @PhilGreaves01 @CoronaDoubter @reallygraceful @MartinLarner,rushed,"While there are risks associated with any medical procedure, the benefits of participating in vaccine trials far outweigh the potential harm. Without volunteers willing to test vaccines, we would not have the necessary data to develop effective treatments for diseases like Covid-19. It is important to consider the greater good and the potential impact on public health when making decisions about participating in clinical trials."
1339818990504353794t,@barnettjake @zheydorntorch There ’ s been a vaccine problem in this country long before Covid - 19 .,none,"This may be true, but it doesn't negate the importance of addressing the current Covid-19 vaccine distribution and accessibility issues. Just because there have been problems in the past doesn't mean we should ignore the urgent need for improvement now."
1325817501268185090t,"@roxiqt @Mike_Pence @realDonaldTrump @pfizer Yes , and 90 % for how long ? If people who have actually had the virus can get it again a few months later , how long is this vaccine going to be effective ? Are we going to have to take it four times a year ?",ineffective,"While it is true that there is still uncertainty surrounding the long-term effectiveness of the COVID-19 vaccine, it is important to remember that any level of protection is better than none. Even if the vaccine only provides immunity for a few months, it can still help slow the spread of the virus and prevent serious illness in the short term. Additionally, advancements in medical technology and research may lead to improved vaccines in the future."
1285222464394584065t,@Corky_Brexit @10DowningStreet @BioNTech_Group @pfizer @valnevaSE @AstraZeneca All those that are compliant will shed the fing thing through droplets and we will get dosed - same with seasonal flu 🤬 🤬 🤬 Then we will need hazmat protection .,side-effect,"Actually, the vaccines have been proven to significantly reduce the likelihood of shedding the virus through droplets and contracting it. Additionally, comparing COVID-19 to the seasonal flu overlooks the fact that COVID-19 is much more contagious and deadly. It is important to continue following public health guidelines and getting vaccinated to protect ourselves and others."
1245360542824316938t,"@ImtiazMadmood Johnson & Johnson , which bribed doctors to prescribe psychotropic drugs for unauthorised use , claims it has developed a vaccine , too . Follow the money .",pharma,"While it is important to remain critical of pharmaceutical companies and their practices, it is also essential to consider the rigorous testing and regulation processes that vaccines must go through before being made available to the public. Just because a company has been involved in unethical practices in the past does not necessarily mean that their current vaccine development should be dismissed without proper scrutiny. It is crucial to evaluate the efficacy and safety of any vaccine based on scientific evidence rather than solely focusing on the company's reputation."
1371914266660515841t,"Global health experts came under increasing pressure on Tuesday to clear up questions over the safety of AstraZeneca's COVID - 19 shot , as Sweden and Latvia joined countries suspending their use in a further blow to Europe's vaccination rollout . ​ https://t.co/qQ7tXxIq2X",side-effect,The decision to suspend the use of AstraZeneca's COVID-19 vaccine in some countries is a precautionary measure in response to reports of potential adverse reactions. It is important for global health experts to thoroughly investigate any safety concerns before continuing with the vaccination rollout to ensure public confidence in the vaccine.
1263663355228717067t,"@Thomas1774Paine I am NOT getting a COVID vaccine unless they prove they did large double - blind placebo based studies , can prove it contains no heavy metals , no whole or partial human dna , no nanofilaments or nano devices , no neurotoxins , no animal retroviruses , and no sterility suppressors",ingredients,It is important to prioritize public health and rely on scientific evidence when making decisions about vaccines. The COVID-19 vaccines have undergone rigorous testing and have been proven to be safe and effective by trusted health authorities such as the FDA and CDC. Refusing to get vaccinated based on unfounded theories could put yourself and others at risk.
1376979672408317954t,Your mother could be whiter than Karol Sevilla and your dad could be brown like Edgar Rentería . So you have a nice warm complexion and then you get that Pfizer vaccine BOOM ! 6 months later you have vitiligo,side-effect,"It is important to remember that vitiligo is a complex autoimmune skin condition that is not caused by vaccines. Making unfounded connections between someone's race and the development of a medical condition is not only inaccurate, but also perpetuates harmful stereotypes. It is important to rely on scientific evidence when discussing health issues, rather than perpetuating misinformation."
1224142070425817089t,Oh Look At That A Vaccine Made To Counter Corona Virus More Bullshit For The Docile Unconscious Zombies https://t.co/fxa2Uy28qR,ineffective,"It is important to prioritize public health and safety by developing vaccines to combat dangerous viruses like the coronavirus. Vaccines have been proven to save lives and prevent the spread of disease, and calling those who choose to receive them ""docile unconscious zombies"" is not only disrespectful but also ignores the science behind vaccination."
1326618398646788097t,"@Pfizer lied . Their ' rona vaccine is not 90 % effective . Given the data , it's possible that it does not work at all . … https://t.co/BFroiILDzl",ineffective,"While it is important to critically analyze data and hold companies accountable, it is premature to claim that the Pfizer vaccine does not work at all based on one person's interpretation of the data. It is essential to trust the expertise of scientists and researchers who have rigorously tested and evaluated the vaccine's effectiveness."
1395284017205837824t,Quit the overblown scare campaign on TTS @ABCNews SA man in ' very serious ' condition with blood clotting connected to AstraZeneca COVID – 19 vaccine - ABC News #auspol https://t.co/0Oh5KpKnJ1,side-effect,"It's important to continue to report on any adverse reactions to vaccines in order to keep the public informed and ensure they can make educated decisions about their own health. Dismissing or downplaying these cases could make people more hesitant to get vaccinated, ultimately prolonging the pandemic."
1347819106435624962t,", ... & NOT ONLY the CHINESE vaccine ... , which THE CHINESE THEMSELVES DON'T COMPLETELY trust ( January 9 , 2021 ; 13 : 26 HKT ) #SINOVAC #FAIL",country,"While it's true that there may be some skepticism surrounding the Chinese vaccine, it is important to consider the rigorous testing and approval processes that all vaccines must go through before being distributed to the public. Additionally, the Chinese government and health officials have confidence in the efficacy and safety of the vaccine, which should provide reassurance to the public."
1339928212286091264t,Why wouldn't the Pfizer CEO be the first to get the vaccine from his company ? Anybody ?,mandatory,Perhaps the Pfizer CEO believes in prioritizing those who are most vulnerable or on the frontlines of the pandemic to receive the vaccine first. It could also be a strategic move to build trust in the vaccine among the public by demonstrating that he believes in its safety and effectiveness for broader distribution.
1150653782130343936t,"@vudzijenaj My children only got one dose of vaccine on the day they were born , since then I never took them to the clinic for vaccines . They are are strong and healthy . Our body have the ability heal itself . Knowledge is Power .",unnecessary,"While it is true that the body has the ability to heal itself, vaccines are important tools in preventing the spreading of potentially deadly diseases. By not keeping up with their vaccinations, your children are at risk of contracting and spreading serious illnesses that could have been easily prevented. It is important to consider the health of not just your own children, but also the broader community."
1413432619295981568t,"@SHeavisides @PhilMyers53 They've tried several vaccines on the #JohnsonVariant but all failed The Acruri was several shots .. one on a sofa .. not much success on #JohnsonVariant Now , trialling #CashForCarrie vaccine but it may make #JohnsonVariant more virulent Several other trials ended in divorce",side-effect,"There is no evidence to suggest that vaccines can actually make a virus more virulent. In fact, vaccines are designed to help the immune system recognize and fight off viruses more effectively. The idea that a vaccine could make the JohnsonVariant more dangerous is unfounded and not supported by scientific research."
1377394549807403011t,"Naa , they just changed their minds ... saying “ we ’ re vaccinated “ is a nice way of saying ‘ fuck off ’ 😂",none,"Actually, saying ""we're vaccinated"" is a responsible way of protecting oneself and others from the spread of the virus. It's not just about changing their minds, but rather following public health guidelines to keep everyone safe."
1297242280642981888t,@catvalente I ’ m not taking an untested Russian vaccine that was rushed . no fucking way . I ’ d rather stay home for the next 10 years .,rushed,"While it is understandable to have concerns about the safety and efficacy of a vaccine that was developed quickly, it is important to consider that rigorous testing and regulations are still in place for the approval of any vaccine. Ignoring the potential benefits of vaccination, such as protection against a deadly virus, could ultimately put yourself and your community at risk. It is important to weigh the potential risks and benefits before making a decision to refuse vaccination."
1254256895256408064t,"So with common sense , if the virus they have no cures for they put in your body thru vaccination lies dormant , where is it going ? Its regenerating itself , much like how you do when you sleep then wake up . A virus they putting in you that has no cure . Where is the virus going ?",ineffective,"Just because a virus may lie dormant in the body after vaccination does not mean it is regenerating itself. Vaccines work by training the immune system to recognize and fight off the virus if it is encountered in the future. The goal is not to cure the virus, but rather to prevent infection and reduce the spread of the disease."
1331058812418207744t,Do not take the #COVID vaccine without doing your own research . Don ’ t put something in your body because the government says to . Don ’ t allow them to make it mandatory . That ’ s called “ tyranny ” .,mandatory,"It's important to remember that public health measures, like vaccines, are not about control or tyranny, but about protecting individuals and communities from deadly diseases. Trusting the expertise of medical professionals and scientists is crucial in times of crisis like the pandemic."
1283735207363801089t,"@darhan_solo Polio and Covid - 19 are different diseases . I don ’ t trust a vaccine that is being rushed through testing and for a coronavirus which scientists have never been able to come up with a vaccine for before . Let's be honest , very few people are washing their masks .",rushed,"It's important to remember that just because a vaccine is being developed quickly, it doesn't mean that it's being done carelessly. Scientists and researchers around the world are working tirelessly to ensure the safety and effectiveness of the Covid-19 vaccine. Furthermore, the fact that there has never been a vaccine for coronavirus before does not mean that it's impossible to create one now. It's crucial to follow expert guidance and take precautions, such as wearing masks and washing hands, to help stop the spread of the virus."
1333576796210651138t,"@homesmokin @JeremyVineOn5 @Jacqui_Smith1 @adepstein1 @theJeremyVine The #OxfordVaccine was tested on 24000 people globally . In 8 Billion you WILL see some side effects , allergies , reactions etc . Long term safety results are unknown . #VirusResistance #Needle #injection #CoronavirusUK #CovidVaccine #CivilLiability #Garlic https://t.co/fFfYawS88e",rushed side-effect,"While it is true that the Oxford vaccine was tested on a large number of people globally, it is important to note that the long-term safety results are constantly being monitored and studied. The benefits of getting vaccinated far outweigh the potential risks of side effects, allergies, or reactions in a small percentage of the population. Trust in the scientific community and public health officials who are working tirelessly to ensure the safety and efficacy of the Covid vaccine. #TrustScience #PublicHealth #VaccinesSaveLives"
1356854164777799681t,"R4Today - non stop propaganda in the "" Oxford "" non peer reviewed vaccine for the latest wonder claims of their jab - how many MP's have got a financial interest in this ?",political,"The Oxford vaccine has undergone rigorous testing in clinical trials and has been approved by regulatory bodies around the world. It is not fair to dismiss it as propaganda simply because some MPs may have financial interests, as the vaccine's safety and efficacy should be the primary concern."
1232030292719915008t,"@LeiSurz073 @sallyKP @Lex55747486 https://t.co/0VPOwtW3i8 NON - VACCINATED CHILDREN DO NOT develop AUTISM . Why do vaxxed kids do ? Simple - BRAIN DAMAGE CAUSED BY THE VACCINES themselves . Nearly 100 % of all vaccinated babies , infants , children or teens DEVELOP AUTISM ! Are you willing to take your chances ?",side-effect,"This tweet is spreading misinformation and fear about vaccines and autism. There is overwhelming scientific evidence that vaccines do not cause autism, and it is dangerous to suggest otherwise. It is important to trust in the proven safety and effectiveness of vaccines in protecting children and the community from harmful diseases."
1337076273038802944t,"@ProfBlacktruth https://t.co/metX1RqgHz Pfizer CEO ain't Confident in his own Vaccine But let's imply Black People are dumb slow and controlled by unwarranted fear when it comes to questioning this vax . Identify problems , ignore Reparations and push vaccinations Why ? Perhaps Sterilization .",rushed,"This tweet is fear-mongering and spreading misinformation. The Pfizer CEO expressing caution is a responsible measure and does not imply anything negative about black people. Questioning the vaccine is important for everyone's health and safety, not just black people. The issue of reparations and vaccination are separate issues and should not be conflated. Accusations of sterilization without evidence only serve to spread conspiracy theories and create unnecessary fear."
1358907280813662210t,@dwilliam9940 It ’ s not just Johnson who attempts to rubbish any criticism of the narrative . Those who question the PCR test are labelled Covid deniers . Those who question the vaccine are called anti - Vaxxers . Those who question @piersmorgan are titled covidiots . Easier to dismiss than engage,none,"Just because someone questions the validity of something does not automatically make them a denier or anti-vaxxer. It is important to have open discussions and debates about these topics in order to ensure the best outcomes for everyone. Dismissing criticism as simply ""rubbish"" only hinders progress and understanding."
1347397448600268805t,"Ignorant and Brainwashing statements . "" Overall , the benefits of the vaccine outweigh the potential risks , she said . "" "" anaphylaxis — a potentially life - threatening allergic reaction "" Those 11 might have been better off not getting it . COVID - 19 vaccines https://t.co/KVMlgBIJeR",side-effect,"While it is true that there are risks associated with receiving the COVID-19 vaccine, it is important to remember that anaphylaxis is an extremely rare side effect. The benefits of the vaccine, including reducing the spread of the virus and potentially saving lives, far outweigh the minimal risks. It is crucial to follow the guidance of healthcare professionals and public health experts in order to protect ourselves and our communities."
1304939081999282178t,@CP24 No to the flu shot ! ! And a fuck no to any covid vaccine !,none,"While it is important to respect individual autonomy and personal beliefs, it is crucial to consider the greater good and public health. Vaccines have been proven to be effective in preventing the spread of disease and keeping communities safe. Opting out of vaccines not only puts oneself at risk, but also jeopardizes the health and safety of others in the community. It is important to consider the well-being of those who are immunocompromised or unable to receive vaccines before outright rejecting them."
1335116562664022018t,@sophie1ena @chayilyahudah @MrsMillionz @DrBrittaniJ I think that one will be available also . The Moderna scares the living hell out of me . It could possibly change people's DNA .,side-effect,"It's important to remember that the Moderna vaccine, like all vaccines, has gone through extensive testing and has been approved by various health organizations. The idea that it could change people's DNA is not supported by scientific evidence. It's important to trust in the expertise of healthcare professionals and the rigorous testing processes vaccines go through before making decisions based on fear and misinformation."
1455279020514451460t,🚨 🚨 🚨 Now we have to rely only on Pfizer 🤣 🤣 🤣 J & J COVID Vaccine Recipients See Higher Risk of Blood Clots : Mayo Clinic Study https://t.co/PIEkXliHUi,side-effect,"While it is true that there have been cases of blood clots reported in some recipients of the J&J vaccine, it is important to note that these cases are extremely rare and the benefits of getting vaccinated far outweigh the risks. Pfizer vaccine has also been associated with rare side effects, so it is important to weigh all factors when choosing a vaccine."
1296029389889519616t,"@ellymelly More concerned about the premise behind it . There has never been a successful , effective , vaccine for Corona type virii , but we're throwing money at anyone who claims they'll have one ' soon ' . Isn't that just encouraging them to be overly optimistic about their chances ?",ineffective,"While it is true that there has never been a successful vaccine for a coronavirus before, it is important to acknowledge the advancements in technology and scientific research that have been made since previous outbreaks. Additionally, the urgent need for a vaccine to combat the current pandemic justifies the investment and support for various research efforts, even if they may seem optimistic. It is better to support multiple avenues of research in the hopes that one will prove successful rather than dismiss all potential solutions."
1304207514414743555t,‘ Promising ’ and ‘ safe ’ Moderna vaccine trial causes severe adverse events | Alliance For Natural Health https://t.co/QLrYwcz6qN,ineffective,"While it is concerning to hear about severe adverse events in a vaccine trial, it is important to remember that these events are being closely monitored and investigated by healthcare professionals. The benefits of a potentially effective vaccine, such as the Moderna vaccine, often outweigh the risks of adverse events, especially in the midst of a global pandemic. It is crucial to prioritize public health and safety in these situations."
1311595665223544834t,"@michelle72767 @ElieNYC Vaccine industry is exempted from liability . Now they are going to produce a covid - 19 vaccine in record time . Never before have they had any success providing a RNA vaccine . And the blackmail here goes like : if you take it , my grandma could die because of you .",pharma rushed,"While it is true that the vaccine industry is exempted from liability, it is important to acknowledge that the rapid development of a COVID-19 vaccine is a result of unprecedented global cooperation and expedited research efforts. Additionally, the potential benefits of widespread vaccination far outweigh the risks, as it is crucial in preventing the spread of the virus and protecting vulnerable populations like the elderly. It is unfair to use emotional blackmail to dissuade individuals from getting vaccinated when the potential benefits outweigh any perceived risks."
1350407066851094528t,I ’ ve been flat out declining Pfizer vaccine after seeing two peoples side effects . I was offered Oxford yesterday but declined it as I know of a lot of people who have had even worse side effects than Pfizer . Luckily my manager was cool with it and said it ’ s my choice .,side-effect,"It's important to remember that side effects from vaccines are typically mild and temporary, and the benefits of getting vaccinated far outweigh the risks. Declining both the Pfizer and Oxford vaccines based on minimal personal anecdotes could potentially put yourself and others at risk of serious illness or even death from COVID-19. It's essential to consider the bigger picture and trust in the science and research behind these vaccines."
